<?xml version="1.0" encoding="UTF-8" standalone="no"?>
<!DOCTYPE notebook PUBLIC "-//W3C//DTD XML 1.00//EN" "xnotes.dtd">
<notebook title="Recette de cuisine">
  <section title="b">
    <note><![CDATA[<p>bonjour, ceci est un test</p>]]></note>
    <note><![CDATA[]]></note>
  </section>
  <section title="c">
    <note><![CDATA[<p>Cd</p>]]></note>
    <note><![CDATA[<p>Ca</p>]]></note>
    <note><![CDATA[Cb]]></note>
    <note><![CDATA[tete]]></note>
    <note><![CDATA[kikou mon coco]]></note>
    <note><![CDATA[Cc]]></note>
  </section>
  <section title="a">
    <note><![CDATA[Ac]]></note>
    <note><![CDATA[Aa]]></note>
    <note><![CDATA[Ab]]></note>
  </section>
  <section title="d">
    <note><![CDATA[turlute]]></note>
    <note><![CDATA[turlute]]></note>
  </section>
</notebook>
